{
  "schema": "sensor.report.v1",
  "tool": {
    "name": "semverguard",
    "version": "0.1.0",
    "repository_url": null
  },
  "run": {
    "started_at": "2024-01-15T10:00:00Z",
    "finished_at": "2024-01-15T10:01:00Z",
    "duration_ms": 60000,
    "workspace_root": "/workspace",
    "baseline": {
      "kind": "git",
      "version": null,
      "rev": "origin/main",
      "root": null,
      "rustdoc": null
    }
  },
  "verdict": {
    "status": "pass"
  },
  "findings": [],
  "data": null,
  "artifacts": {
    "report_json": "artifacts/semverguard/report.json",
    "comment_md": "artifacts/semverguard/comment.md",
    "sarif_json": null,
    "raw_logs": []
  }
}
